{
  "$schema": "https://json-schema.org/draft/2020-12/schema",
  "$id": "https://raw.githubusercontent.com/beyelin6/vmax-teaching-skills/main/core/schemas/vmax/output-manifest.schema.json",
  "title": "V-MAX Output Manifest",
  "type": "object",
  "required": ["object_type", "lesson_id", "slide_script_version", "version", "status", "outputs", "derived_from", "canvas_lock"],
  "properties": {
    "object_type": { "const": "OUTPUT_MANIFEST" },
    "lesson_id": { "type": "string" },
    "slide_script_version": { "type": "string" },
    "version": { "type": "string" },
    "status": { "enum": ["DRAFT", "TEACHER_REVIEW", "OUTPUT_QA", "APPROVED", "SUPERSEDED", "BLOCKED"] },
    "teacher_confirmation_status": { "enum": ["NOT_REVIEWED", "WAITING_TEACHER", "CONFIRMED", "CHANGES_REQUESTED"] },
    "canvas_lock": { "$ref": "#/$defs/canvasLock" },
    "outputs": {
      "type": "array",
      "items": {
        "type": "object",
        "required": ["output_id", "format", "status", "derived_from", "affected_slides"],
        "properties": {
          "output_id": { "type": "string" },
          "format": { "enum": ["NOTEBOOKLM_KNOWLEDGE_SOURCE", "NOTEBOOKLM_SLIDE_AUDIO", "GOOGLE_SLIDES_IMPORT", "CANVA_IMPORT", "PNG", "PDF", "PPTX"] },
          "status": { "enum": ["HANDOFF_READY", "RENDER_VERIFIED", "BLOCKED", "SUPERSEDED"] },
          "platform": { "type": ["string", "null"] },
          "asset_ref": { "type": ["string", "null"] },
          "verification_report_ref": { "type": ["string", "null"] },
          "derived_from": { "$ref": "#/$defs/derivedFrom" },
          "affected_slides": { "type": "array", "items": { "type": "string" } },
          "impact_note": { "type": ["string", "null"] },
          "teacher_confirmation_ref": { "type": ["string", "null"] }
        },
        "allOf": [{
          "if": { "properties": { "status": { "const": "RENDER_VERIFIED" } }, "required": ["status"] },
          "then": {
            "required": ["asset_ref", "verification_report_ref"],
            "properties": {
              "asset_ref": { "type": "string", "minLength": 1 },
              "verification_report_ref": { "type": "string", "minLength": 1 }
            }
          }
        }],
        "additionalProperties": false
      }
    },
    "derived_from": { "$ref": "#/$defs/derivedFrom" }
  },
  "allOf": [{
    "if": { "properties": { "status": { "const": "APPROVED" } }, "required": ["status"] },
    "then": {
      "required": ["teacher_confirmation_status"],
      "properties": {
        "teacher_confirmation_status": { "const": "CONFIRMED" },
        "outputs": { "minItems": 1 }
      }
    }
  }],
  "$defs": {
    "derivedFrom": {
      "type": "object",
      "required": ["direct_parent", "lineage"],
      "properties": {
        "direct_parent": { "type": "string" },
        "lineage": { "type": "array", "items": { "type": "string" } }
      },
      "additionalProperties": false
    },
    "canvasLock": {
      "type": "object",
      "required": ["profile", "ratio", "width_px", "height_px", "orientation", "safe_area", "fit_mode", "output_formats", "teacher_decision_ref"],
      "properties": {
        "profile": { "enum": ["lesson_presentation_16_9_v1", "lesson_presentation_4_3_v1"] },
        "ratio": { "enum": ["4:3", "16:9"] },
        "width_px": { "type": "integer", "minimum": 1 },
        "height_px": { "type": "integer", "minimum": 1 },
        "orientation": { "const": "LANDSCAPE" },
        "safe_area": { "type": "string" },
        "fit_mode": { "enum": ["PRESERVE_ASPECT_CONTAIN_OR_APPROVED_CROP"] },
        "output_formats": { "type": "array", "minItems": 1, "uniqueItems": true, "items": { "enum": ["PNG", "PDF", "PPTX"] } },
        "teacher_decision_ref": { "type": "string" }
      },
      "additionalProperties": false
    }
  },
  "additionalProperties": false
}
